{
  "schemaVersion": "recognition-video-audio-plan/v1",
  "characterId": "yi-v6",
  "script": "看，一只小鸟。晨光直直的。念，一。这就是一。",
  "voice": {
    "provider": "edge-tts",
    "voice": "zh-CN-XiaoxiaoNeural",
    "rate": "-10%",
    "pitch": "+0Hz",
    "rationale": "继承 v3/v4/v5 同一 Xiaoxiao 女老师声 + -10% 慢速；v6 不动 voice/rate，避免在叙事层重构的同时引入声线变量；4 段叙事在 -10% 下实测 raw=7.464s，留 ≥0.5s final quiet 仍贴 8s spoken body 上限"
  },
  "durationBenchmark": {
    "sourceModel": "hongen-micro-lesson/v1",
    "referenceProduct": "洪恩识字 一 字单页认字微课（公开 demo）",
    "referenceDurationSeconds": {
      "min": 25,
      "max": 45,
      "example": 32
    },
    "referenceEvidence": "洪恩公开 demo 单字卡通常 25-45s 覆盖意义/字形/组词/笔顺/互动；P03 是认字流程中的 recognition 短片，承担其中的意义→字形→收束三段；v6 叙事层重构后 spoken body 仍固定在 8s 内（实测 raw=7.464s），把节省下来的时间投入到 silent prologue 0-0.1s + dwell + stroke-order tail 三段呼吸，与洪恩「信息密度堆满」的工业风刻意拉开",
    "starlightTargetSeconds": 8,
    "starlightDecision": "P03 recognition v6 spoken body 固定为 8.0s（schema 上限 + audio-plan validator 硬约束）：4 段叙事 raw=7.464s，留 0.536s final quiet ≥0.45s；视频总时长 12s 含 10-12s 静默笔顺示范尾段，由 paddedTotalDurationSeconds=12 表达，与 brief.duration=12 同步"
  },
  "targetDurationSeconds": 8,
  "paddedTotalDurationSeconds": 12,
  "bakedAudioDurationSeconds": 12.048,
  "audioPaddingNotes": "edge-tts 直出 4 段旁白合成单 mp3 实测 raw=7.464s（measured-timings 文件给出 rawAudioEndSeconds=7.402s，与 ffprobe raw 时长一致 ±0.07s 内），末端用 ffmpeg apad 静音填充至 12.048s（ffprobe 实测）与视频 12s 等长；t=7.4-12s 段为静默尾声，覆盖 ink-glyph 末段 dwell + stroke-order-tail 全段；apad 不剪视频，padded 与 brief.duration=12 对齐 ≤0.05s 误差",
  "quietAfterLastCueSeconds": 0.598,
  "cues": [
    {
      "id": "concrete-anchor",
      "shotId": "dawn-valley",
      "text": "看，一只小鸟。",
      "audioStart": 0.1,
      "audioEnd": 2.327,
      "visualStart": 0.1,
      "visualEnd": 2.28,
      "narration": "spoken",
      "rationale": "意义入场（concrete anchor）：旁白与 dawn-valley plate 上的 bird-flight-loop sprite 同步入场，让「一只小鸟」音画同框；这是 v6 区别 v5 最强的叙事修复——把抽象的「一」绑定到画面上可数的 1 只小鸟物象，规避 v5「一道光」量词在画面无视觉计数锚的硬伤。visual 略早于 audio 完成 (0.05s gap) 让 narration 收音时镜头已开始 cross-dissolve 到 light-band"
    },
    {
      "id": "phrase-bridge",
      "shotId": "light-band",
      "text": "晨光直直的。",
      "audioStart": 2.277,
      "audioEnd": 4.208,
      "visualStart": 2.28,
      "visualEnd": 4.28,
      "narration": "spoken",
      "rationale": "字形绑定：旁白与 light-band plate 同步，「直直的」点出光带的水平字形特征，与未来宣纸上楷体「一」横笔形状一一对应；visual 略早于 audio 完成 (0.07s gap) 让镜头已开始 cross-dissolve 到 light-to-ink；v6 用形容词「直直的」替代 v5 的量词「一道光」，规避量词无视觉计数锚的硬伤"
    },
    {
      "id": "glyph-naming",
      "shotId": "ink-glyph",
      "text": "念，一。",
      "audioStart": 4.208,
      "audioEnd": 5.833,
      "visualStart": 4.28,
      "visualEnd": 5.85,
      "narration": "spoken",
      "rationale": "字音绑定（glyph naming）：旁白与 ink-glyph plate + html-glyph-ink-bleed mask 中后段同步，「念，一」让孩子在看到字渗墨成形的同时听到字音，建立 字-音 绑定钩；这是 v5 没有显式标注的 glyph-naming 角色，v6 用 narration-spec role coverage 强制要求"
    },
    {
      "id": "extension",
      "shotId": "ink-glyph",
      "text": "这就是一。",
      "audioStart": 5.833,
      "audioEnd": 7.402,
      "visualStart": 5.85,
      "visualEnd": 8.0,
      "narration": "spoken",
      "rationale": "重复 + 字形收束（extension）：旁白与 ink-glyph plate 完整态同步，第 3 次说「一」让 narration-spec 强制的 ≥3 次重复达标；cue visualEnd=8.0 = target spoken body 上限（validator 硬约束 visualEnd ≤ target+0.35），cue 的可视窗口在 spoken body 内闭合；ink-glyph 镜头的物理 hold 由 brief.shotPlan ink-glyph duration=5.72s (4.28→10.0) 覆盖，cue visualEnd 与 shot visualEnd 解耦；audioEnd 7.402s → cue visualEnd 8.0s 提供 0.598s 静默回看（≥ 0.45s syncRule#3），再过渡到 8.0-10.0 ink-glyph dwell，再切 stroke-order-tail"
    },
    {
      "id": "stroke-order-tail",
      "shotId": "stroke-order-tail",
      "text": "",
      "audioStart": null,
      "audioEnd": null,
      "visualStart": 10.0,
      "visualEnd": 12.0,
      "narration": "silent",
      "rationale": "纯视觉笔顺尾段：t=10-12s 米字格水印识字态→写字态切换 + 楷体「一」字 left-to-right 二次渗墨 + 孩子手指悬入摹字。让孩子在没有旁白的静默里专注看完整一笔笔顺与摹字动作；audio-plan 用 ffmpeg apad 把 narration mp3 补到 paddedTotalDurationSeconds=12s 与视频等长。受 tail-spec yi-v6.tail-spec.json + anchors/mizige-anchors.json 双重约束"
    }
  ],
  "syncRules": [
    "每一段旁白起始时刻 (audioStart) 与对应镜头的视觉 cue 起始 (visualStart) 同帧或视觉略早 ≤ 0.12s；4 段 spoken 旁白与 dawn-valley / light-band / ink-glyph / ink-glyph 一一对齐（glyph-naming 与 extension 共享 ink-glyph 段，由 mask 渗墨阶段区分）",
    "每一段旁白结束后镜头视觉至少持续 0.08s 不立即切换，保证孩子语义闭合；extension 旁白结束 (7.402s) 后 ink-glyph 镜头 dwell 到 10.0s，留 ~2.6s 让宣纸上的墨字稳定回看",
    "末段「这就是一」旁白结束 (7.402s) 后保留 0.598s 安静再进入 stroke-order-tail，syncRule#3 要求 ≥0.45s 满足",
    "stroke-order-tail 段 (10-12s) 为 narration=\"silent\" 静默 cue，不占 spoken target；视觉窗口由 paddedTotalDurationSeconds=12s 覆盖，apad 不剪视频",
    "baked mp3 末端 apad 至 paddedTotalDurationSeconds=12s，ffprobe 实测 12.048s 与 brief.duration=12s 对齐 ≤0.05s 误差；4 段旁白合成体 raw=7.464s + 静音填充 ~4.6s"
  ],
  "outputs": {
    "audio": "src/clients/mobile-h5/assets/recognition/yi/yi-v6-narration.mp3",
    "rawAudio": "src/clients/mobile-h5/assets/recognition/yi/yi-v6-narration-raw.mp3",
    "subtitles": "src/clients/mobile-h5/assets/recognition/yi/yi-v6-narration.vtt"
  }
}
